{
    "$schema": "../schemas/topology.json",
    "timestart": {"days":-15},
    "timeend": {"hours":0},
    "forecast_timeend": {"days": 5},
    "time_offset_start": {"hours": 0},
    "nodes": [
        {
            "id": 1,
            "name": "Salto Grande - Flow hydrograph - 1H",
            "hec_node": {
                "River": "Uruguay",
                "Reach": "Bajo",
                "River_Stat": 1151708,
                "Interval": "1HOUR",
                "CondBorde": "Folw Hydrograph"
            },
            "series": [
                {
                    "series_id": 927,
                    "lim_outliers": [
                        0,
                        40000
                    ],
                    "lim_jump": 15000,
                    "x_offset": 0,
                    "y_offset": 0
                }
            ],
            "series_prono": [
                {
                    "series_id": 7833,
                    "lim_outliers": [
                        0,
                        40000
                    ],
                    "lim_jump": 15000,
                    "x_offset": 0,
                    "y_offset": 0,
                    "comment": "tabprono Bajo Uruguay",
                    "cal_id": 485,
                    "qualifier": "medio",
                    "adjust": false
                }
            ],
            "time_interval": {
                "hours": 1
            },
            "time_offset": null,
            "interpolation_limit": 48,
            "output_series_id": 31571,
            "adjust_prono": true
        },
        {
            "id": 2,
            "name": "Nueva Palmira - Stage Hydrograph -1H",
            "hec_node": {
                "River": "Uruguay",
                "Reach": "Bajo",
                "River_Stat": 16577,
                "Interval": "1HOUR",
                "CondBorde": "Stage Hydrograph"
            },
            "series": [
                {
                    "series_id": 3280,
                    "lim_outliers": [
                        -1.7,
                        3.42
                    ],
                    "lim_jump": 0.4,
                    "x_offset": 0,
                    "y_offset": 0.0275
                },
                {
                    "series_id": 2111,
                    "lim_outliers": [
                        -2.01,
                        2.66
                    ],
                    "lim_jump": 0.5,
                    "x_offset": 0,
                    "y_offset": 0
                }
            ],
            "series_prono": [
                {
                    "series_id": 26203,
                    "lim_outliers": [
                        -1.7,
                        3.42
                    ],
                    "lim_jump": 0.4,
                    "x_offset": 0,
                    "y_offset": 0.0275,
                    "comment": "N Palmira prono regre",
                    "cal_id": 433,
                    "adjust": true
                }
            ],
            "time_interval": {
                "hours": 1
            },
            "time_offset": null,
            "output_series_id": 31555
        }
    ]
}
